{
  "$schema": "http://json-schema.org/draft-07/schema#",
  "$id": "https://motif.dev/schemas/graph-node.schema.json",
  "title": "graph-node",
  "type": "object",
  "required": [
    "id",
    "type",
    "label"
  ],
  "properties": {
    "id": {
      "type": "string",
      "pattern": "^[a-z0-9-]+$"
    },
    "type": {
      "type": "string",
      "enum": [
        "user",
        "role",
        "task",
        "workflow",
        "screen",
        "information-object",
        "action",
        "state",
        "pattern",
        "effect",
        "recipe",
        "component",
        "constraint",
        "evidence",
        "test",
        "decision"
      ]
    },
    "label": {
      "type": "string"
    },
    "attributes": {
      "type": "object"
    }
  },
  "additionalProperties": false
}
